{
  "schema_version": "kspacejet.execution-plan/v1",
  "kind": "ExecutionPlan",
  "input_digests": {
    "resolved_pipeline": "sha256:1111111111111111111111111111111111111111111111111111111111111111",
    "scan_descriptor": "sha256:2222222222222222222222222222222222222222222222222222222222222222",
    "target_envelope": "sha256:3333333333333333333333333333333333333333333333333333333333333333",
    "machine_policy": "sha256:4444444444444444444444444444444444444444444444444444444444444444",
    "provider_contracts": [
      "sha256:eeeeeeeeeeeeeeeeeeeeeeeeeeeeeeeeeeeeeeeeeeeeeeeeeeeeeeeeeeeeeeee"
    ]
  },
  "execution_profile": "bounded-online",
  "key_slot_tables": [
    {
      "node_id": "reconstruct",
      "dense_dimensions": [
        { "field": "slice", "minimum": 0, "cardinality": 1 }
      ],
      "mapping_algorithm_id": "dense-mixed-radix/v1",
      "storage_accounting_id": "kspacejet.key-slot-storage/dense-v1",
      "key_domain_bound": 1,
      "max_distinct_keys": 1,
      "max_live_keys": 1,
      "slot_count": 1,
      "generation_policy": "monotonic-u64/v1",
      "initial_generation": 1,
      "seal_on_completion": true,
      "eviction_policy": "completed-only",
      "late_event_policy": "fail",
      "host_metadata_charged_bytes": 32,
      "max_items_per_activation": 1,
      "max_charged_bytes_per_activation": 1024
    }
  ],
  "reorder_plans": [
    {
      "node_id": "reconstruct",
      "order_domain_id": "reconstruct",
      "ordinal_binding_id": "completed-frame-slot-context-semantic-key/v1",
      "completed_frame_input_port": "frame",
      "ordered_output_port": "image",
      "outputs_per_ordinal": 1,
      "charged_bytes_per_ordinal": 128,
      "ordinal_dimensions": [
        { "field": "slice", "minimum": 0, "cardinality": 1 }
      ],
      "mapping_algorithm_id": "dense-cartesian-ordinal/v1",
      "storage_accounting_id": "kspacejet.reorder-storage/dense-cartesian-v1",
      "ordinal_domain_bound": 1,
      "first_expected_ordinal": 0,
      "last_expected_ordinal": 0,
      "max_ahead_items": 1,
      "max_ahead_charged_bytes": 128,
      "max_gap_ordinals": 0,
      "occurrence_policy": "strict-dense-all-tuples-eoi-fail",
      "publish_policy": "next-expected-only",
      "certified_skipped_ordinals": [],
      "end_of_input_policy": "fail",
      "host_metadata_charged_bytes": 32,
      "descriptor_charged_count": 1
    }
  ],
  "edge_capacities": [],
  "resource_vector": {
    "host_normal_bytes": 192,
    "host_pinned_bytes": 0,
    "host_hugepage_bytes": 0,
    "shared_host_bytes": 0,
    "spool_bytes": 0,
    "transport_bytes": 0,
    "descriptor_count": 1,
    "async_token_count": 0,
    "cpu_leaf_permits": 1,
    "backend_gang_permits": 0,
    "provider_private_permits": 0,
    "io_slots": 1,
    "devices": []
  },
  "terminal_occurrences": 1,
  "proof_obligations": [
    "PO-01.typed_ports",
    "PO-07.m3_completed_frame_slot_binding",
    "RA-01.m3_strict_dense_all_tuples_eoi"
  ]
}
